"placename","description","image","link","lat","lon"
"Площадь коммерции","Площадь Коммерции - одна из красивейших площадей столицы Португалии Лиссабона. Ее также называют Дворцовой, потому что до землетрясения 1755 года здесь находился королевский дворец, построенный королем Мануэлем I. В центре четырехугольной площади можно увидеть конный памятник королю-реформатору Жозе I. На площади возвышается также изящная триумфальная арка, являющаяся одним из символов Лиссабона, украшенная барельефами и статуями. На месте, где был разрушенный дворец, можно увидеть здания с аркадами. На южной стороне площади находятся две квадратные башни. Находясь на площади Коммерции, можно насладиться прекрасным видом на реку Тежу, а также есть возможность попасть к реке, преодолев спуск по лестнице.","commerce_square.jpg","http://www.rutraveller.ru/place/7508",38.7083135,-9.1364929
"Монастырь Жеронимуш","Монастырь Жеронимуш считается архитектурной жемчужиной португальской столицы. Здесь буквально каждая деталь поряжает воображение своим величием, праздничностью, торжественностью. В 16 веке по приказу короля Мануэля I Удачливого началось строительство монастыря Жеронимуш,в знак благодарности Деве Марии за благополучное завершение плавания Васко да Гамы. Замок выполнен в традиционном стиле мануэлино, сочетающем готический стиль, мавританское влияние и даже элементы Ренессанса. Раньше на этом месте стояла маленькая часовня в честь Святой Марии. Теперь она разрослась до большого храма. Гравюры в церкви Святой Марии изображают сцены из жизни святого Жерома. В интерьере великолепная каменная кладка. В стенах монастыря Жеронимуш погребены многие выдающиеся деятели, в числе которых Васко да Гама, поэты Геркулано и Фернандо Пессоа, Луис Камоенс. В 1984 году монастырь Жеронимуш был включен в список Всемирного наследия ЮНЕСКО.","zheronimush.jpg","http://www.rutraveller.ru/place/1198",38.698083000000004,-9.206693
"Башня Торри де Белен","В Лиссабоне нельзя пройти мимо уникального памятника португальской архитектуры эпохи Возрождения – башни Белен, возвышающейся над водами реки Тежу. Португальцы воздвигли этот укрепленный форт в честь знаменитой экспедиции мореплавателя Васко да Гама, открывшего путь в Индию. Башня изначально задумывалась как пятиярусная крепость-маяк. Ее строительство велось в период с 1515 по 1521 год при короле Мануэле I. Именно отсюда отважные португальские мореплаватели отправились в поисках новых торговых путей. Еще некоторое время назад Башня выполняла роль тюрьмы и оружейного склада. Башня богато декорирована изображениями канатов, ажурными балконами, башенками в арабском стиле, зубчатыми стенами и даже гербами рыцарского ордена.Это великолепное сооружение, высота которого составляет 35 метров, считается ярчайшим образцом позднеготического стиля ""мануэлино"", типичного архитектуры Португалии. Начиная с XIX века этот памятник облюбовали романтики и он начал привлекать путешественников. В 1983 году башня была включена в список Всемирного наследия ЮНЕСКО.","torri_de_belen.jpg","http://www.rutraveller.ru/place/1192",38.691827,9.215967
"Памятник Первооткрывателям","Памятник сделан из известняка и железобетона, его высота составляет 54 метра, ширина основания - 20 метров. Открытие памятника состоялось в 1960 году. Монумент сделан в виде каравеллы, украшенный гербом Португалии времён королевской династии Авизов. Главная в скульптуре - фигура Энрике мореплавателя, за ним, по 16 фигур с каждой стороны, располагаются 32 фигуры людей, прославившихся во времена великих открытий. Внутри монумента находятся лекционный зал, выставочные павильоны и лифт, поднимающийся до смотровой площадки. На площади перед скульптурной композицией из гранита выложены роза ветров и карта мира с датами португальских морских экспедиций.","pioneers.jpg","http://www.rutraveller.ru/place/5550",38.693822999999995,-9.205689999999999
"Мост 25-го апреля","Мост 25-го апреля — один из двадцати самых длинных висячих мостов мира, пересекающий место впадения реки Тежу в Атлантический океан и соединяющий Лиссабон на северном (правом) и Алмаду на южном (левом) берегу. Был открыт 6 августа 1966 года. До 1974 года мост носил имя Антониу Салазара, португальского государственного и политического деятеля, но впоследствии был переименован. Строительными работами руководила американская Мостостроительная компания. Стоимость возведения моста составила 32 миллиона долларов США, в процессе строительства израсходовано 263 000 м³ бетона и 72 600 тонн стали. Полная длина моста составляет 2 277,64 метра, каждые сутки около 380 000 человек пересекают мост в обоих направлениях. На мосту были отсняты сцены из нескольких известных фильмов, в том числе - шестой фильм об английском суперагенте Джеймсе Бонде «На секретной службе Её Величества» (1969 год) – единственный, в котором главную роль исполнил Джордж Лэзенби.","bridge_25_april.jpg","http://www.rutraveller.ru/place/4239",38.689809000000004,-9.177111
"Лифт Санта Жушта","Лифт Санта Жушта, который также называют«Подъёмник Карму и Лифт Эйфеля» был спроектирован и построен в 1898 – 1902 годах португальским инженером Раулем Месньером дю Понса, учеником знаменитого Александра Густава Эйфеля. Сооружение подъёмника выполнено из чугуна, фасады декорированы в неоготическом стиле. Высота лифта составляет 45 метров. «Подъёмник Карму» - не только поражающая своей красотой ажурная конструкция посреди города, но и часть системы общественного транспорта. Лифт Санта Жушта расположен в районе Байши и доставляет горожан и гостей Лиссабона в другой район - Шиаду, перенося пассажиров на 32-метровую высоту за 5 минут. Изначально лифты перемещались посредством паровой машины, но с 1907 года они функционируют от электродвигателей. Подъемник рассчитан на два лифта. Вместимость каждого из них - 19 сидячих и 10 стоячих мест. Кстати, на вершине башни находится кафе с террасой, с которой открывается великолепнейшая панорама Лиссабона.","lift_santa_zhusta.jpg","http://www.rutraveller.ru/place/6893",38.712398,-9.139483
"Площадь Россио","Площадь Россио является одной из главных площадей Лиссабона, столицы Португалии. Можно сказать, что у этой площади два названия. Старое, еще с XIII-XIV веков, название Россио, и официальное, с 1874 года, название Площадь Дона Педро IV. Площадь вымощена темными и светлыми булыжниками таким образом, что образуется узор в виде волн, украшена роскошными бронзовыми фонтанами. На площади можно увидеть памятник королю Педро IV на высоком постаменте, а также здание Национального театра Дона Марио II. Раньше на месте театра находился дворец инквизиции.","rossio_square.jpg","http://www.rutraveller.ru/place/7503",38.714063,-9.139403
"Триумфальная арка","Триумфальная арка была построена во время восстановления Лиссабона после сильного землетрясения 1755 года. Хотя её и начали строить в этом году, закончили только в 1873. Есть мнение, что на строительство арки португальцев вдохновила французская архитектура. Спроектировал её Вериссимо да Кошта, установив на ней часы и аллегорические фигуры Славы, Изобретательности и Мужества, а также статуи реальных людей: Виритауша, Нуно Алвареша Перейра, Васко да Гама и Маркиза Помбал. Однако, оформлением арки занимались сразу несколько скульпторов, которые стремились доказать всем, что лиссабонцы все равно отсроят свой город заново, сколько бы землетрясений ни случилось.","arc_triumph.jpg","http://www.rutraveller.ru/place/5740",38.708696, -9.136771
"Лиссабонский кафедральный собор Се","Лиссабонский кафедральный собор Се, Мария Майор де Лисбоа, или Собор Се, - центральный собор Лиссабона. Он является древнейшей церковью в городе, к тому же возведенной на фундаменте мечети. Строительство началось в 1147 году, и за это время здание многократно менялось и пережило несколько землетрясений. Теперь собор является образцом сочетания сразу нескольких архитектурных стилей. В 1448 году королева Леонор основала при соборе Лиссабонский дом милосердия, и влияние этого благотворительного учреждения распространилось по всей стране, включая ее колонии. В наши дни оно продолжает свою работу. В центральном дворе собора недавно проводились археологические исследования, в ходе которых были обнаружены свидетельства римской, арабской и средневековой эпохи. А в июне собор становится центром праздника в честь Святого Антонио, который отмечается ежегодно.","cathedral.jpg","http://www.rutraveller.ru/place/1193",38.710096,-9.132595
"Крепость святого Георгия","Замок Святого Георгия, расположенный в историческом центре города, на возвышенности, является главным замком Лиссабона. Местные жители чаще всего называют этот замок ""Колыбелью города"", поскольку считается, что имено в этом месте начался отсчет истории столицы Португалии. Принято считать, что заселение этого участка началось задолго до появления римлян. На самой вершине холма стояла крепость, защищавшая реку Тагус и окрестности. В период с 5 в до н..э. и вплоть до начала 8 века крепость принадлежала вест-готам, но потом ее захватили сарацины. Часть сохранившихся до наших дней стен была построена во время господства мавров, которое продлилось вплоть до 1147 г. После изгнания мавров Афонсу Энрикеш основал свое королевство. Спустя триста лет в этом замке проходили пышные торжества по поводу возвращения Васко да Гама из Индии. После переезда резиденции королей, замок Св.Георгия служил в качестве театра, тюрьмы и арсенала. Как и многие исторические сооружения, он был сильно разрушен в ходе землетрясения 1755 года.","saint_george.jpg","http://www.rutraveller.ru/place/1197",38.7139092,-9.133476199999999
"Улица Аугушта","Одна из самых необычных и колоритных улиц Лиссабона находится в центре города. Rua Augusta - главный пешеходный бульвар, где всегда много горожан и туристов. Она соединяет триумфальную арку на Терейру-ду-Пасу с площадью Россиу. Лучшего места для неспешной пешей прогулки с необычными кафешками и интересными магазинчиками в Лиссабоне просто не найти. Улица Аугушта - это довольно широкий пешеходный бульвар, созданный еще в XVIII веке. Его мостовая вымощена вручную из небольших черных и белых плиток, образующих сложный орнамент. Эти тротуары называются кальсада и привлекают множество туристов. Здесь всегда много уличных торговцев различными сладостями, жаренными каштанами или небольшими сувенирчиками ручной работы. Здесь часто дают небольшие представления уличные артисты и циркачи. Пестрые лавки торговцев и прогуливающиеся продавцы цветов с огромными корзинами делают эту улицу необычайно яркой и запоминающейся. Улица Аугушта знаменита и своими ювелирными магазинчиками. Их легко найти по названиям: Руа-да-Прата - улица серебра и Руа-ду-Оуру - улица золота. На пересечении Rua Augusta с другими улочками расположены открытые летние кафе и кондитерские, в которых можно перекусить и полюбоваться пестрой жизнью. Здесь можно поесть и более основательно - например, в ресторане Concha d'Ouro, знаменитом своими блюдами из морепродуктов.","augusta_street.jpg","http://www.rutraveller.ru/place/4264",38.710834000000006,-9.137653
"Мост Васко-да-Гама","Длина моста Васко да Гама составляет 17,2 километра, этот удивительной красоты мост, которому не видно ни конца, ни края, является на сегодняшний день самым длинным мостом Европы. Мост проложен через чистейшую реку Тежу и глядя на него создается впечатление, что архитекторы моста при его создании думали не только о практической, но и об эстетической стороне проекта. Мосту Васко да Гама не просто так дали такое необычное название, ведь его открытие 29 марта 1998 года приурочили к 500-летней годовщине открытия великим мореплавателем Васко да Гамой пути из Европы в Индию. Мост Васко да Гама в состоянии выдерживать силу ветра до 250 км/ч и сильные землетрясения. Интересным фактом является то, что при строительстве моста пришлось учесть даже шарообразную форму Земли, иначе разница в высоте между северной и южной оконечностями моста составила бы 80 сантиметров. При строительстве моста учитывалось так же его влияние на окружающую среду: для минимизации вмешательства в естественную среду реки Тежу ночное освещение моста спроектировали таким образом, чтобы направленный свет мощных ламп не попадал на реку. Через мост Васко да Гама организовано шестиполосное автомобильное движение, а при надобности, в часы пик, добавляются ещё две разгрузочные полосы.","vasco_da_gama_bridge.jpg","http://www.rutraveller.ru/place/7673",38.758085, -9.037467
"Парк Эдуарда VII","Парк Эдуарда VII находится в Лиссабоне, столице Португалии. Ранее этот парк носил название Парк свободы, но был переименован в 1903 году, спустя год после визита в Португалию английского короля Эдуарда VII, который приезжал с целью подтвердить союз между Португалией и Англией. Крупнейший парк Лиссабона, площадью 25 гектаров, находится на склоне холма, начинающегося от площади маркиза Памбала. Великолепный парк с аллеями, вымощенными мозаикой, украшен статуями, кустами строгой геометрической формы, в нем можно увидеть беседку, пруды, ландшафтный сад. В северо-западной части парка находится оранжерея Estufa Fria, так называемая холодная оранжерея, с экзотическими растениями. В этой оранжерее есть возможность полюбоваться такими растениями, как, например, фуксии и пальмы, а также ручейками и даже небольшими водопадами. А в Estufa Quente, отапливаемой оранжерее, можно увидеть теплолюбивые растения, над которыми порхают тропические птицы. Рядом с оранжереями находится пруд, в котором водятся крупные карпы.","park_eduardo.jpg","http://www.rutraveller.ru/place/8268",38.726786700000005,-9.1542704
"Байру Алту","Квартал Байру Алту находится в Лиссабоне, столице Португалии. Этот живописный квартал был заново отстроен после страшного землетрясения 1755 года. Еще с XVI века этот район считается традиционным местом, где любят селиться представители богемы: художники, артисты, музыканты. Квартал славится своими книжными и антикварными магазинами, галереями. Он придется также по вкусу любителям ночной жизни: здесь можно найти множество модных ночных клубов, баров, ресторанов и кафе. В ресторанах и кабачках здесь можно услышать авторские песни под гитару в исполнении местных музыкантов, а также песни ""фаду"", представляющие собой смесь цыганской песни и романсов.","bairu_altu.jpg","http://www.rutraveller.ru/place/9245",38.7127532,-9.1462951
