"placename","description","image","link","lat","lon"
"Океанариум Лиссабона","Океанариум в Лиссабоне на момент постройки являлся самым большим океанариумом Европы. Он был создан в 1998 году в рамках проходившей в Португалии выставки «ЭКСПО-98». Здание из стекла и бетона, возвышающееся над водами реки Тежу, стало частью комплекса Васко да Гама. Инициатором создания концептуальной постройки, в которой размещается океанариум, выступил Питер Чермайефу. Этот человек также был дизайнером самого большого океанариума в мире, который находится в Осаке, а также других океанариумов по всему миру. Лиссабонский океанариум рад предложить своим посетителям посмотреть на большую коллекцию морских видов млекопитающих, рыб и других морских организмов. Всего представлено 16 000 особей 450 видов. Внутри здания располагается один главный аквариум, а вокруг него – четыре, в которых живут различные животные. Всего на первом этаже представлено 25 аквариумов.","oceanarium.jpg","http://www.rutraveller.ru/place/5019",38.761179999999996,-9.096285
"Базилика-да-Эштрела","Базилика-да-Эштрела в Лиссабоне, построенная в честь Святого Сердца Иисуса, пожалуй является одной из красивейших церквей Европы, популярной у туристов. Это величественное сооружение было возведено в XVIII веке по монаршему велению королевы Марии I, в 1790 году. Летопись гласит, что королева, в день бракосочетания, дает обещание возвести в Лиссабоне храм, если Господь дарует ей наследника. И после рождения у Марии Португальской сына Жозе, в 1779 году начинается строительство церкви. Этот удивительный памятник архитектуры Лиссабона был построен двумя архитекторами, Рейналдом душ Сантушом и Матеушу де Оливейра. Если приглядеться к фасаду здания, можно увидеть удивительное сочетание барокко и неготического стиля. Сам фасад состоит из трех частей: выступающая центральная часть в виде арок делится на фусты, колонны и капители. Вся конструкция великолепно дополняется изваяниями ангелов, шестью аллегориями и барельефами. Терраса построенная вокруг центрального купола и колоколен-близнецов, позволит насладиться прекрасным видом на Лиссабон. Сам купол Базилики-да-Эштрела, увенчанный башней с крестом и виден издалека. Внутри вы увидите гробницу королевы Марии, надгробная плита которой сделана из черно-белого мрамора. Еще одна достопримечательность - сцена Рождения Христа, состоящая из 500 миниатюрных фигурок, вырезанных из терракоты и пробкового дерева.Базилика-да-Эштрела являясь памятником архитектуры эпохи средневековья, стала историческим достоянием португальского народа.","basilica_de_estrela.jpg","http://www.rutraveller.ru/place/36915",38.71334,-9.160796000000001
"Иезуитская церковь Лиссабона","Иезуитская церковь Святого Роха находится в Лиссабоне, столице Португалии. Она названа в честь Святого Роха,защитника от чумы. Церковь была построена в 1555-1619 годах на месте, где до XVI века располагалось кладбище для жертв чумы и явилась первой церковью иезуитов в Португалии. По иезуитской традиции, церковь имеет весьма скромный внешний вид и роскошное внутреннее убранство. Прекрасный главный алтарь украшен скульптурами известнейших деятелей ордена иезуитов. Интерьер церкви выполнен из ценных пород дерева, слоновой кости, мрамора и драгоценных минералов: яшмы, агата, лазурита, аметиста. В церкви также находится богатая коллекция церковной утвари и одеяний. В структуру церкви входит капелла Иоанна Крестителя, возведенная в 1742 году. Она была создана в Италии известными скульпторами и архитекторами, а затем перевезена в Португалию на трех кораблях. Капелла украшена ценными мозаичными панно, на которых изображены библейские сцены. Здесь находятся также изразцовые панно, созданные в 1584 году в стиле португальской майолики.","saint_Roja.jpg","http://www.rutraveller.ru/place/9234",38.713759,-9.143502
"Дворец Келуш","Дворец Келуш – великолепный памятник архитектуры, достойный искреннего восхищения. Построенный королем Педро III в качестве подарка жене королеве Марии I, дворец Келуш поражает своими роскошными формами. Строительство дворца длилось несколько лет - с 1742 по 1767 годы, а вокруг него был разбит пышный сад с фонтанами и статуями. Возглавил строительство нового дворца для короля Педро III и его невесты Марии I придворный архитектор Матеуш Висенте ди Оливейра, создавший удивительное по красоте творение, которое принято считать едва ли не последним ярким образцом стиля рококо. На посетителей дворец Келуш производит грандиозное впечатление. Теперь каждый желающий может полюбоваться изысканным Тронным залом, в котором несколько веков назад разыгрывались великолепные балы и торжественные банкеты. Особую пышность добавляют огромные зеркала, прекрасные хрустальные люстры и покрытые золотом скульптуры. Затем следует музыкальный зал, в котором звучали оперы и концерты в исполнении королевского оркестра. Потолок королевской спальни сделан в форме купола и оформлен фресками со сценами из ""Дон Кихота"", а пол изготовлен из экзотических пород дерева. Самое торжественное помещение - комната для послов - пол здесь выложен из мраморных плит, а на потолке изображены картины из жизни королевской семьи. Вокруг дворца разбит пышный сад и парк, в котором раньше проводились рыцарские турниры, устраивались концерты, фейерверки и развлекательные мероприятия для королевских гостей.","kelush_palace.jpg","http://www.rutraveller.ru/place/8407",38.7507229,-9.2590824
"Акведук Aguas Livres","Акведук Aguas Livres расположен в столице Португалии, городе Лиссабон. В переводе с португальского языка, Aguas Livres означает «свободная вода». Грандиозное сооружение является замечательным примером инженерной мысли португальских архитекторов XVIII века. Основная часть виадука протяжена на 18 километров, но если учесть полную длину каналов, Aguas Livres простирается почти на 58 километров. Строительство сооружения начал король Иоанн V, во времена, когда Лиссабон страдал от острой нехватки качественной воды. Акведук был возведен в 1744 году за проектом архитектора Жозе да Силва Паиша. Центральная часть сооружения проходит над долиной Алькантара на высоте до 65 метров. 35 каменных, заостренных арок покрывают длину в почти 1 километр. Арочная структура виадука построена в готическом стиле.","aqueduc_aguash_librish.jpg","http://www.rutraveller.ru/place/110883",38.726893,-9.166417
"Национальный Пантеон","Национальный Пантеон - яркое архитектурное сооружение в стиле Португальское барокко. Его строительство было начато в конце 17 века. Благодаря тому, что церковь многократно перестраивали и очень долго не могли достроить, появилась поговорка ""работы Святой Энграсии"" - так говорят про различные долгострои. Это связано с тем, что работы над сооружением были начаты в 1682 году, а торжественное открытие здания состоялось только в 1966 году, после установки главного купола. В этом же году церковь Святой Энграсии стала Национальным Пантеоном. Здесь захоронены многие известные деятели Португалии. Все здание выполнено в едином стиле, и все его элементы хорошо гармонируют друг с другом. На крыше здания расположена смотровая площадка, с которой открывается чудесный вид на город.","national_panteon.jpg","http://www.rutraveller.ru/place/19275",38.715253999999995,-9.124694
"Монастырь Сан-Висенте-де-Фора","Монастырь Сан-Висенте-де-Фора - это одна из самых значимых достопримечательностей Португалии. Он расположен в Лиссабоне, в квартале Алфама. Церковь названа в честь покровителя Лиссабона, Св. Винсента. Его мощи покоятся на этом месте с 1173 года. Церковь, сохранившаяся здесь до настоящего времени, была построена по приказу короля Филиппа II Испанского в 1629 году. Церковь представляет собой здание, выполненное из белого известняка в стиле позднего ренессанса с двумя башнями, украшенными миниатюрными шпилями. Над входом в нишах расположены статуи Винсента, Августина и Себастьяна. Особого внимания заслуживает внутренне убранство церкви, балдахин алтаря, окруженный деревянными скульптурами, а также орган 18 века. К зданию церкви примыкает здание бывшего августинского монастыря, знаменитый изразцовой настенной живописью 18 века. Также в церкви находится пантеон королевской династии.","san_vincente_de_fora.jpg","http://www.rutraveller.ru/place/15208",38.715097,-9.127682
"Стадион ""Эштадиу да Луш""","Эштадиу да Луш является одним из лучших и современнейших стадионов Европы. Он впечатляет своими размерами и формами. На нём проводит свои домашние матчи футбольный клуб ""Бенфика"". Стадион был открыт в 2000 году. Он построен на месте старого стадиона. В переводе с португальского его название означает ""Стадион Света"". Его вместимость составляет более 65 тысяч зрителей. Сам стадион имеет овальную форму, с несколькими уровнями трибун. Крыша сооружения имеет сложную конструкцию с разными дугами и волнами. На вид стадион просто огромен. Стадион использовали для проведения матчей Чемпионата Европы 2004 года, в том числе и финала турнира. Также стадион ""Да Луш"" был утвержден исполкомом УЕФА для проведения финала Лиги Чемпионов в 2014 году.","estadio_da_lush.jpg","http://www.rutraveller.ru/place/36215",38.752945000000004,-9.184763
"Лиссабонская тюрьма","Лиссабонская тюрьма – это одно из известнейших старинных сооружений города, которое расположено возле современного здания Дворца юстиции, на улице Прогресс, возле парка имени Эдуарда VII. Тюрьма была построена в 1800 году, и до сих пор продолжает исполнять свои функции. Трудно поверить в то, что это красивое старинное ухоженное здание архитектуры является тюрьмой, потому что с виду оно напоминает древний музей. Жители Лиссабона шутят, что это самый дешёвый отель города.","prison.jpg","http://www.rutraveller.ru/place/40485",38.730298,-9.158052
